{"attribution":"OECD (2025), Pensions at a Glance 2025: OECD and G20 Indicators — OECD Data Explorer DF_PAG (OECD pension-model measures only). Licence: CC-BY-4.0 (https://www.oecd.org/en/about/terms-conditions.html). Retrieved 2026-10-16. Adapted by Epochs of One: see \"transform\"; the source owner does not endorse this adaptation. OECD disclaimer: this is an adaptation of an original work by the OECD; opinions and arguments expressed in the adaptation should not be reported as representing the official views of the OECD or of its Member countries.","keep":{"CRPLF22":"current normal retirement age (entry at 22)","FRPLF22":"future normal retirement age (entry at 22)","GPRR100":"gross replacement rate, average earner","NPRR100":"net replacement rate, average earner"},"dropped":["ATRAEP","ATRPPAE","ATRW","AWGW","CIOP","EDIOP","EIOP","ELMEA","ER","EYLME","FR","GPRR200","GPRR50","GPW100","GPW200","GPW50","LE","NPRR200","NPRR50","NPW100","NPW200","NPW50","OAIP","OAWAR","OCOP","PEP","PPEP","PTOP"],"data":{"AUS":{"CRPLF22_F":{"y":2024,"v":67},"CRPLF22_M":{"y":2024,"v":67},"FRPLF22_F":{"y":2024,"v":67},"FRPLF22_M":{"y":2024,"v":67},"NPRR100_F":{"y":2024,"v":0.501},"GPRR100_F":{"y":2024,"v":0.385},"NPRR100_M":{"y":2024,"v":0.53},"GPRR100_M":{"y":2024,"v":0.408}},"AUT":{"CRPLF22_F":{"y":2024,"v":60.5},"FRPLF22_F":{"y":2024,"v":65},"FRPLF22_M":{"y":2024,"v":65},"CRPLF22_M":{"y":2024,"v":65},"NPRR100_F":{"y":2024,"v":0.868},"GPRR100_F":{"y":2024,"v":0.741},"NPRR100_M":{"y":2024,"v":0.868},"GPRR100_M":{"y":2024,"v":0.741}},"COL":{"CRPLF22_M":{"y":2024,"v":62},"CRPLF22_F":{"y":2024,"v":57},"FRPLF22_M":{"y":2024,"v":62},"FRPLF22_F":{"y":2024,"v":57},"NPRR100_F":{"y":2024,"v":0.731},"GPRR100_F":{"y":2024,"v":0.748},"NPRR100_M":{"y":2024,"v":0.731},"GPRR100_M":{"y":2024,"v":0.748}},"CRI":{"CRPLF22_F":{"y":2024,"v":63},"FRPLF22_F":{"y":2024,"v":63},"CRPLF22_M":{"y":2024,"v":65},"FRPLF22_M":{"y":2024,"v":65},"NPRR100_F":{"y":2024,"v":0.658},"GPRR100_F":{"y":2024,"v":0.622},"NPRR100_M":{"y":2024,"v":0.695},"GPRR100_M":{"y":2024,"v":0.657}},"CZE":{"CRPLF22_M":{"y":2024,"v":64.2},"CRPLF22_F":{"y":2024,"v":64.2},"FRPLF22_F":{"y":2024,"v":67},"FRPLF22_M":{"y":2024,"v":67},"NPRR100_F":{"y":2024,"v":0.559},"GPRR100_F":{"y":2024,"v":0.442},"NPRR100_M":{"y":2024,"v":0.559},"GPRR100_M":{"y":2024,"v":0.442}},"DNK":{"CRPLF22_F":{"y":2024,"v":67},"CRPLF22_M":{"y":2024,"v":67},"FRPLF22_M":{"y":2024,"v":74},"FRPLF22_F":{"y":2024,"v":74},"NPRR100_F":{"y":2024,"v":0.771},"GPRR100_F":{"y":2024,"v":0.727},"NPRR100_M":{"y":2024,"v":0.771},"GPRR100_M":{"y":2024,"v":0.727}},"EST":{"CRPLF22_F":{"y":2024,"v":64.8},"CRPLF22_M":{"y":2024,"v":64.8},"FRPLF22_F":{"y":2024,"v":71},"FRPLF22_M":{"y":2024,"v":71},"NPRR100_F":{"y":2024,"v":0.378},"GPRR100_F":{"y":2024,"v":0.293},"NPRR100_M":{"y":2024,"v":0.378},"GPRR100_M":{"y":2024,"v":0.293}},"FRA":{"CRPLF22_M":{"y":2024,"v":64.3},"CRPLF22_F":{"y":2024,"v":64.3},"FRPLF22_F":{"y":2024,"v":65},"FRPLF22_M":{"y":2024,"v":65},"NPRR100_F":{"y":2024,"v":0.7},"GPRR100_F":{"y":2024,"v":0.566},"NPRR100_M":{"y":2024,"v":0.7},"GPRR100_M":{"y":2024,"v":0.566}},"DEU":{"CRPLF22_M":{"y":2024,"v":66.2},"CRPLF22_F":{"y":2024,"v":66.2},"FRPLF22_F":{"y":2024,"v":67},"FRPLF22_M":{"y":2024,"v":67},"NPRR100_F":{"y":2024,"v":0.533},"GPRR100_F":{"y":2024,"v":0.421},"NPRR100_M":{"y":2024,"v":0.533},"GPRR100_M":{"y":2024,"v":0.421}},"GRC":{"CRPLF22_F":{"y":2024,"v":62},"CRPLF22_M":{"y":2024,"v":62},"FRPLF22_M":{"y":2024,"v":66},"FRPLF22_F":{"y":2024,"v":66},"NPRR100_F":{"y":2024,"v":0.885},"GPRR100_F":{"y":2024,"v":0.796},"NPRR100_M":{"y":2024,"v":0.885},"GPRR100_M":{"y":2024,"v":0.796}},"HUN":{"CRPLF22_F":{"y":2024,"v":62},"FRPLF22_F":{"y":2024,"v":62},"CRPLF22_M":{"y":2024,"v":65},"FRPLF22_M":{"y":2024,"v":65},"NPRR100_F":{"y":2024,"v":0.728},"GPRR100_F":{"y":2024,"v":0.484},"NPRR100_M":{"y":2024,"v":0.78},"GPRR100_M":{"y":2024,"v":0.519}},"ISL":{"CRPLF22_F":{"y":2024,"v":67},"CRPLF22_M":{"y":2024,"v":67},"FRPLF22_F":{"y":2024,"v":67},"FRPLF22_M":{"y":2024,"v":67},"NPRR100_F":{"y":2024,"v":0.533},"GPRR100_F":{"y":2024,"v":0.439},"NPRR100_M":{"y":2024,"v":0.533},"GPRR100_M":{"y":2024,"v":0.439}},"IRL":{"CRPLF22_F":{"y":2024,"v":66},"CRPLF22_M":{"y":2024,"v":66},"FRPLF22_M":{"y":2024,"v":66},"FRPLF22_F":{"y":2024,"v":66},"NPRR100_F":{"y":2024,"v":0.337},"GPRR100_F":{"y":2024,"v":0.243},"NPRR100_M":{"y":2024,"v":0.337},"GPRR100_M":{"y":2024,"v":0.243}},"ISR":{"CRPLF22_M":{"y":2024,"v":67},"CRPLF22_F":{"y":2024,"v":62},"FRPLF22_M":{"y":2024,"v":67},"FRPLF22_F":{"y":2024,"v":65},"NPRR100_F":{"y":2024,"v":0.468},"GPRR100_F":{"y":2024,"v":0.365},"NPRR100_M":{"y":2024,"v":0.544},"GPRR100_M":{"y":2024,"v":0.428}},"ITA":{"CRPLF22_M":{"y":2024,"v":64.8},"CRPLF22_F":{"y":2024,"v":63.8},"FRPLF22_M":{"y":2024,"v":70},"FRPLF22_F":{"y":2024,"v":70},"NPRR100_F":{"y":2024,"v":0.79},"GPRR100_F":{"y":2024,"v":0.706},"NPRR100_M":{"y":2024,"v":0.79},"GPRR100_M":{"y":2024,"v":0.706}},"KOR":{"CRPLF22_F":{"y":2024,"v":63},"CRPLF22_M":{"y":2024,"v":63},"FRPLF22_F":{"y":2024,"v":65},"FRPLF22_M":{"y":2024,"v":65},"NPRR100_F":{"y":2024,"v":0.389},"GPRR100_F":{"y":2024,"v":0.334},"NPRR100_M":{"y":2024,"v":0.389},"GPRR100_M":{"y":2024,"v":0.334}},"LVA":{"CRPLF22_M":{"y":2024,"v":64.8},"CRPLF22_F":{"y":2024,"v":64.8},"FRPLF22_M":{"y":2024,"v":65},"FRPLF22_F":{"y":2024,"v":65},"NPRR100_F":{"y":2024,"v":0.522},"GPRR100_F":{"y":2024,"v":0.387},"NPRR100_M":{"y":2024,"v":0.522},"GPRR100_M":{"y":2024,"v":0.387}},"LTU":{"CRPLF22_F":{"y":2024,"v":64.3},"CRPLF22_M":{"y":2024,"v":64.7},"FRPLF22_F":{"y":2024,"v":65},"FRPLF22_M":{"y":2024,"v":65},"NPRR100_F":{"y":2024,"v":0.282},"GPRR100_F":{"y":2024,"v":0.174},"NPRR100_M":{"y":2024,"v":0.282},"GPRR100_M":{"y":2024,"v":0.174}},"LUX":{"CRPLF22_F":{"y":2024,"v":62},"CRPLF22_M":{"y":2024,"v":62},"FRPLF22_F":{"y":2024,"v":62},"FRPLF22_M":{"y":2024,"v":62},"NPRR100_F":{"y":2024,"v":0.877},"GPRR100_F":{"y":2024,"v":0.756},"NPRR100_M":{"y":2024,"v":0.877},"GPRR100_M":{"y":2024,"v":0.756}},"NLD":{"CRPLF22_F":{"y":2024,"v":67},"CRPLF22_M":{"y":2024,"v":67},"FRPLF22_M":{"y":2024,"v":70},"FRPLF22_F":{"y":2024,"v":70},"NPRR100_F":{"y":2024,"v":0.96},"GPRR100_F":{"y":2024,"v":0.747},"NPRR100_M":{"y":2024,"v":0.96},"GPRR100_M":{"y":2024,"v":0.747}},"NOR":{"CRPLF22_F":{"y":2024,"v":67},"CRPLF22_M":{"y":2024,"v":67},"FRPLF22_F":{"y":2024,"v":67},"FRPLF22_M":{"y":2024,"v":67},"NPRR100_F":{"y":2024,"v":0.549},"GPRR100_F":{"y":2024,"v":0.461},"NPRR100_M":{"y":2024,"v":0.549},"GPRR100_M":{"y":2024,"v":0.461}},"POL":{"CRPLF22_F":{"y":2024,"v":60},"FRPLF22_F":{"y":2024,"v":60},"CRPLF22_M":{"y":2024,"v":65},"FRPLF22_M":{"y":2024,"v":65},"NPRR100_F":{"y":2024,"v":0.318},"GPRR100_F":{"y":2024,"v":0.224},"NPRR100_M":{"y":2024,"v":0.406},"GPRR100_M":{"y":2024,"v":0.286}},"PRT":{"CRPLF22_F":{"y":2024,"v":65.3},"CRPLF22_M":{"y":2024,"v":65.3},"FRPLF22_F":{"y":2024,"v":68},"FRPLF22_M":{"y":2024,"v":68},"NPRR100_F":{"y":2024,"v":0.927},"GPRR100_F":{"y":2024,"v":0.724},"NPRR100_M":{"y":2024,"v":0.927},"GPRR100_M":{"y":2024,"v":0.724}},"SVK":{"CRPLF22_M":{"y":2024,"v":63.2},"CRPLF22_F":{"y":2024,"v":63.2},"FRPLF22_F":{"y":2024,"v":69},"FRPLF22_M":{"y":2024,"v":69},"NPRR100_F":{"y":2024,"v":0.763},"GPRR100_F":{"y":2024,"v":0.58},"NPRR100_M":{"y":2024,"v":0.763},"GPRR100_M":{"y":2024,"v":0.58}},"SVN":{"CRPLF22_F":{"y":2024,"v":62},"CRPLF22_M":{"y":2024,"v":62},"FRPLF22_M":{"y":2024,"v":62},"FRPLF22_F":{"y":2024,"v":62},"NPRR100_F":{"y":2024,"v":0.713},"GPRR100_F":{"y":2024,"v":0.459},"NPRR100_M":{"y":2024,"v":0.713},"GPRR100_M":{"y":2024,"v":0.459}},"SWE":{"CRPLF22_F":{"y":2024,"v":66},"CRPLF22_M":{"y":2024,"v":66},"FRPLF22_F":{"y":2024,"v":70},"FRPLF22_M":{"y":2024,"v":70},"NPRR100_F":{"y":2024,"v":0.663},"GPRR100_F":{"y":2024,"v":0.637},"NPRR100_M":{"y":2024,"v":0.663},"GPRR100_M":{"y":2024,"v":0.637}},"CHE":{"CRPLF22_F":{"y":2024,"v":64},"FRPLF22_F":{"y":2024,"v":65},"CRPLF22_M":{"y":2024,"v":65},"FRPLF22_M":{"y":2024,"v":65},"NPRR100_F":{"y":2024,"v":0.475},"GPRR100_F":{"y":2024,"v":0.424},"NPRR100_M":{"y":2024,"v":0.475},"GPRR100_M":{"y":2024,"v":0.424}},"TUR":{"CRPLF22_F":{"y":2024,"v":49},"CRPLF22_M":{"y":2024,"v":52},"FRPLF22_F":{"y":2024,"v":63},"FRPLF22_M":{"y":2024,"v":65},"NPRR100_F":{"y":2024,"v":0.927},"GPRR100_F":{"y":2024,"v":0.664},"NPRR100_M":{"y":2024,"v":0.964},"GPRR100_M":{"y":2024,"v":0.691}},"GBR":{"CRPLF22_F":{"y":2024,"v":66},"CRPLF22_M":{"y":2024,"v":66},"FRPLF22_F":{"y":2024,"v":68},"FRPLF22_M":{"y":2024,"v":68},"NPRR100_F":{"y":2024,"v":0.542},"GPRR100_F":{"y":2024,"v":0.447},"NPRR100_M":{"y":2024,"v":0.542},"GPRR100_M":{"y":2024,"v":0.447}},"USA":{"CRPLF22_F":{"y":2024,"v":66.7},"CRPLF22_M":{"y":2024,"v":66.7},"FRPLF22_M":{"y":2024,"v":67},"FRPLF22_F":{"y":2024,"v":67},"NPRR100_F":{"y":2024,"v":0.513},"GPRR100_F":{"y":2024,"v":0.397},"NPRR100_M":{"y":2024,"v":0.513},"GPRR100_M":{"y":2024,"v":0.397}},"ARG":{"CRPLF22_F":{"y":2024,"v":60},"FRPLF22_F":{"y":2024,"v":60},"CRPLF22_M":{"y":2024,"v":65},"FRPLF22_M":{"y":2024,"v":65},"NPRR100_F":{"y":2024,"v":0.759},"GPRR100_F":{"y":2024,"v":0.663},"NPRR100_M":{"y":2024,"v":0.786},"GPRR100_M":{"y":2024,"v":0.687}},"BRA":{"CRPLF22_F":{"y":2024,"v":62},"FRPLF22_F":{"y":2024,"v":62},"FRPLF22_M":{"y":2024,"v":65},"CRPLF22_M":{"y":2024,"v":65},"NPRR100_F":{"y":2024,"v":1.023},"GPRR100_F":{"y":2024,"v":0.933},"NPRR100_M":{"y":2024,"v":0.975},"GPRR100_M":{"y":2024,"v":0.884}},"BGR":{"CRPLF22_F":{"y":2024,"v":62.2},"CRPLF22_M":{"y":2024,"v":64.6},"FRPLF22_M":{"y":2024,"v":65},"FRPLF22_F":{"y":2024,"v":65},"NPRR100_F":{"y":2024,"v":0.753},"GPRR100_F":{"y":2024,"v":0.585},"NPRR100_M":{"y":2024,"v":0.753},"GPRR100_M":{"y":2024,"v":0.585}},"CHN":{"CRPLF22_F":{"y":2024,"v":55},"CRPLF22_M":{"y":2024,"v":60},"FRPLF22_M":{"y":2024,"v":63},"FRPLF22_F":{"y":2024,"v":58},"NPRR100_F":{"y":2024,"v":0.802},"GPRR100_F":{"y":2024,"v":0.619},"NPRR100_M":{"y":2024,"v":1.036},"GPRR100_M":{"y":2024,"v":0.806}},"HRV":{"CRPLF22_F":{"y":2024,"v":63.5},"FRPLF22_F":{"y":2024,"v":63},"FRPLF22_M":{"y":2024,"v":63},"CRPLF22_M"